{
  "pack": {
    "schema": 2,
    "id": "mar",
    "name": "Mar de las Estrellas (en construcción)",
    "version": "0.2.0",
    "license": "Contenido original, todos los derechos reservados al autor del proyecto",
    "language": "es",
    "age_band": "2-12",
    "features": [
      "choice@1"
    ]
  },
  "characters": [
    {
      "id": "bruno",
      "given": "Bruno",
      "noun": "grumete",
      "gender": "m",
      "roles": [
        "hero",
        "helper"
      ],
      "alignment": "positive",
      "trait": {
        "m": "curioso",
        "f": "curiosa"
      },
      "tags": [
        "young",
        "sailor"
      ],
      "attrs": {
        "rasgo": "que quería aprender a leer las estrellas",
        "jura": "¡Por mi pañuelo!",
        "paso": "una brazada más, y otra brazada",
        "gesto": [
          "se ajustó el pañuelo rojo de la cabeza",
          "se rascó la nariz salada",
          "se arremangó la camisa de rayas"
        ],
        "miedo": [
          "se le pusieron los pelos de punta bajo el pañuelo",
          "le temblaron las rodillas como dos gelatinas",
          "se le encogieron los dedos de los pies descalzos"
        ],
        "voz": [
          "con voz clarita",
          "a media voz",
          "mirándose los pies descalzos"
        ],
        "consuelo": "compartió su galleta de barco",
        "regalo": "una conchita con un agujerito, para colgarla del cuello"
      }
    },
    {
      "id": "vega",
      "given": "Vega",
      "noun": "grumete",
      "gender": "f",
      "roles": [
        "hero",
        "helper"
      ],
      "alignment": "positive",
      "trait": {
        "m": "valiente",
        "f": "valiente"
      },
      "tags": [
        "young",
        "sailor"
      ],
      "attrs": {
        "rasgo": "que siempre subía la primera a la cofa",
        "jura": "¡Por mis trenzas!",
        "paso": "un nudo más, y otro nudo",
        "gesto": [
          "se echó las trenzas a la espalda",
          "se colocó bien el pañuelo azul",
          "se sacudió la arena de las rodillas"
        ],
        "miedo": [
          "se le erizaron las trenzas como dos antenas",
          "le temblaron las rodillas como dos gelatinas",
          "se le encogieron los dedos de los pies descalzos"
        ],
        "voz": [
          "con voz clarita",
          "a media voz",
          "mirándose los pies descalzos"
        ],
        "consuelo": "compartió su galleta de barco",
        "regalo": "una conchita con un agujerito, para colgarla del cuello"
      }
    },
    {
      "id": "estela",
      "given": "Estela",
      "noun": "capitana",
      "gender": "f",
      "roles": [
        "helper"
      ],
      "alignment": "positive",
      "trait": {
        "m": "justo",
        "f": "justa"
      },
      "tags": [
        "wise",
        "kind",
        "captain"
      ],
      "attrs": {
        "gesto": [
          "se colocó el sombrero de tres picos",
          "se apoyó en el timón y sonrió",
          "miró el horizonte con el catalejo"
        ],
        "miedo": "se le torció el sombrero",
        "voz": [
          "con su voz de capitana, firme y cálida",
          "con una carcajada que olía a sal",
          "despacio, como quien lee un mapa"
        ],
        "idea": "«En mi barco, el tesoro se cuenta entre todos, o no se cuenta.»",
        "consuelo": "le hizo sitio a su lado junto al timón",
        "regalo": "su farol de barco, ya encendido"
      }
    },
    {
      "id": "faro",
      "given": "Abuelo Faro",
      "noun": "farero",
      "gender": "m",
      "roles": [
        "helper"
      ],
      "alignment": "positive",
      "trait": {
        "m": "sabio",
        "f": "sabia"
      },
      "tags": [
        "wise",
        "old"
      ],
      "attrs": {
        "gesto": [
          "se acarició la barba blanca, que olía a algas",
          "se limpió las gafas con la punta de la camisa",
          "señaló una estrella con el dedo"
        ],
        "miedo": "se le empañaron las gafas",
        "voz": [
          "con su voz lenta de olas",
          "con un guiño",
          "despacito"
        ],
        "idea": "«Las estrellas no se pierden nunca: solo hay que saber mirarlas.»",
        "consuelo": "puso a calentar un cazo de leche con miel",
        "regalo": "un mapa de estrellas dibujado a mano"
      }
    },
    {
      "id": "nacar",
      "given": "Nácar",
      "noun": "sirena",
      "gender": "f",
      "roles": [
        "helper"
      ],
      "alignment": "positive",
      "trait": {
        "m": "cantarín",
        "f": "cantarina"
      },
      "tags": [
        "wise",
        "sea",
        "magic"
      ],
      "attrs": {
        "gesto": [
          "agitó la cola y salpicó estrellitas de agua",
          "se peinó el pelo verde con una espina de pez",
          "tarareó una canción muy bajito"
        ],
        "miedo": "se le escondió la cola debajo de una roca",
        "voz": [
          "con voz de ola pequeña",
          "cantando un poquito",
          "con un susurro de espuma"
        ],
        "idea": "«Escucha el mar: siempre dice por dónde se vuelve a casa.»",
        "consuelo": "le cantó la nana del arrecife",
        "regalo": "una perla del tamaño de un guisante"
      }
    },
    {
      "id": "mostacho",
      "given": "Mostacho",
      "noun": "capitán",
      "gender": "m",
      "roles": [
        "villain"
      ],
      "alignment": "negative",
      "trait": {
        "m": "gruñón",
        "f": "gruñona"
      },
      "tags": [
        "greedy",
        "captain"
      ],
      "attrs": {
        "gesto": [
          "se retorció el bigote",
          "hizo sonar las monedas del bolsillo",
          "resopló como una ballena"
        ],
        "voz": [
          "con voz de trueno chiquito",
          "refunfuñando",
          "con una vocecita que no le pegaba nada"
        ],
        "reacciona": "se quedó con el bigote quieto, sin saber qué decir",
        "guarida": "su barco de velas remendadas"
      }
    },
    {
      "id": "remolino",
      "given": "Remolino",
      "noun": "pulpo",
      "gender": "m",
      "roles": [
        "villain"
      ],
      "alignment": "negative",
      "trait": {
        "m": "travieso",
        "f": "traviesa"
      },
      "tags": [
        "tricky",
        "sea"
      ],
      "attrs": {
        "gesto": [
          "enredó sus ocho brazos en un nudo",
          "cambió de color, de rojo a morado",
          "echó una nubecita de tinta"
        ],
        "voz": [
          "con voz de burbuja",
          "con una risita de agua",
          "haciendo pompas"
        ],
        "reacciona": "se puso de color rosa, de pura vergüenza",
        "guarida": "su cueva de rocas del arrecife"
      }
    }
  ],
  "places": [
    {
      "id": "cubierta",
      "noun": "cubierta de La Gaviota",
      "gender": "f",
      "mood": "calm",
      "tags": [
        "ship"
      ],
      "seasons": [],
      "features": [],
      "times": [
        "dia",
        "atardecer",
        "noche"
      ]
    },
    {
      "id": "camarote",
      "noun": "camarote",
      "gender": "m",
      "mood": "calm",
      "tags": [
        "ship",
        "home"
      ],
      "seasons": [],
      "features": [],
      "times": [
        "dia",
        "noche"
      ]
    },
    {
      "id": "bodega",
      "noun": "bodega del barco",
      "gender": "f",
      "mood": "calm",
      "tags": [
        "ship"
      ],
      "seasons": [],
      "features": []
    },
    {
      "id": "cofa",
      "noun": "cofa del mástil",
      "gender": "f",
      "mood": "calm",
      "tags": [
        "ship",
        "high"
      ],
      "seasons": [],
      "features": [],
      "times": [
        "dia",
        "atardecer",
        "noche"
      ]
    },
    {
      "id": "puerto",
      "noun": "puerto",
      "gender": "m",
      "mood": "calm",
      "tags": [
        "settlement"
      ],
      "seasons": [],
      "features": [],
      "times": [
        "dia",
        "amanecer",
        "atardecer",
        "noche"
      ]
    },
    {
      "id": "playa",
      "noun": "playa de la Isla Quieta",
      "gender": "f",
      "mood": "calm",
      "tags": [
        "island",
        "shore"
      ],
      "seasons": [],
      "features": [],
      "times": [
        "dia",
        "atardecer",
        "noche"
      ]
    },
    {
      "id": "selva",
      "noun": "selva de la isla",
      "gender": "f",
      "mood": "calm",
      "tags": [
        "island",
        "forest"
      ],
      "seasons": [],
      "features": [],
      "times": [
        "dia",
        "atardecer"
      ]
    },
    {
      "id": "cueva_tesoro",
      "noun": "cueva del tesoro",
      "gender": "f",
      "mood": "mystery",
      "tags": [
        "island",
        "cave"
      ],
      "seasons": [],
      "features": []
    },
    {
      "id": "arrecife",
      "noun": "arrecife",
      "gender": "m",
      "mood": "calm",
      "tags": [
        "sea",
        "underwater"
      ],
      "seasons": [],
      "features": [],
      "times": [
        "dia",
        "noche"
      ]
    },
    {
      "id": "faro",
      "noun": "faro",
      "gender": "m",
      "mood": "calm",
      "tags": [
        "shore",
        "high"
      ],
      "seasons": [],
      "features": [],
      "times": [
        "dia",
        "atardecer",
        "noche"
      ]
    },
    {
      "id": "laguna",
      "noun": "laguna de las sirenas",
      "gender": "f",
      "mood": "calm",
      "tags": [
        "sea",
        "shore"
      ],
      "seasons": [],
      "features": [],
      "times": [
        "dia",
        "noche"
      ]
    },
    {
      "id": "mar_abierto",
      "noun": "mar abierto",
      "gender": "m",
      "mood": "calm",
      "tags": [
        "sea"
      ],
      "seasons": [],
      "features": [],
      "times": [
        "dia",
        "atardecer",